{"$schema":"https://json-schema.org/draft/2020-12/schema","$id":"https://futurediff.dev/schemas/certification/provider-mutation-report-0.1.json","type":"object","required":["format_version","generated_at","nonce","targets","certified"],"properties":{"format_version":{"const":"0.1"},"generated_at":{"type":"string","format":"date-time"},"nonce":{"type":"string"},"targets":{"type":"array"},"certified":{"type":"boolean"}}}
